i not agreed the people should d in the computer a lot and i going to said way my first reason is because if you are a sum old man or your not going to d wit your kiss and you going to have eyes problem so that way you should in d in the computer a lot my second reason is the you going to have problem wit your wife if she found out the you are talking to another woman online because a lot of people they wife found out the they can d wit other woman my heard reason is the if you are a kid like me you not going to have fun and you not going to have friends because the computer problem came and go and not going to d wit your family and you ll sister out said playing wit her so that why you holding d a lot in the computer,1
being active has no limit but technology does,12
dear computer cop computers have a negative effect why would you go outside if you could play life like games on your caps i think that the games on t caps should be removed so people could enjoy all of the great things in life if people weren on caps s all day people would pay attention to the way there destroying nature,10
i agree with the newspaper people are spending too much time on the computer and not exercising everyone knows computers adjective but people need to get out more but people making it more admitting by creating things such as never ending games and its distracting people from there life family work and exercise,9
some people think it is a good idea and same do not my opinion is that i think that people spend a lot of time for good reasons here are three reasons why sum grownup working sum students learning how to type and sum communicating with others my first reason is that parents do a lot of work on computer for example they do taxes paperwork airline tickets and the bank and those are usually all done on the computer so it would be easier if people don drive my second reason is students need to learn how to type so they can email or even write on paper it helps them build learning ability and also so they can know how to sing the organization s computers are suppose to be fun for people of any age my last reason is communicating with others is a great skill to have so you can talk in person computers help because if you mess up of what your trying to say then you could just ease what your trying to say and in person you can also you can make plans with one of your friend on something if they live really far or something like that in my opinion i think people should be able to go on the computers to do work playmates no sites and many more other things to go on only if you have a computer at home,3
some people learn about far away places getting the latest updated on important news and making floppy work and hand writing seem nice neat all those thing are some positive benefits people have computers people all over use computers to research other places computers provide photographs of the place cheese is searching for example i remember when i had a social studies project on the person and i had to explain why its a great place to visit for its history mind i never even heard on a place called the person person but thanks to computers i growled person person person then the computer gave me all of into and photo about the mountain caps now i caps where and what the person person mountains look like secondly the computers has all the latest news happening all over the world i remember when the earthquake in habit first happened my grandmother had it happen until she got on line to check organization and when where and earthquake on the richer scale about computers was a i want the best hand writer in class and could write it out or do it on the computer plus we were getting grade on neatness evaporation and fleecy i choose to do it on the computer it came out nice and neat with picture computers has a very positive benefit on people world wide now matter if its for into news or to make thing gates,6
to the local newspaper computers have a heavy impact on today society people depend on them a lot but same people disagree i think that computers have a positive affect on people computers are very entertaining they can help find long lost friend and keep in contact with them plus they can be helpful with homework please proceed on reading to see as why i chose these reasons firstly computers can entertain the are thousands of games to chose from dress up to educational which are good for young children of age five through six as it states in the writing prompt it reaches handed coordination in addition to my first reason computers help long lost friends there are wester that help you find people for example caps caps and yakov these wester help keep in touch to with family if there no phone then there always the computer lastly computers can be helpful with homework sometimes you don even need internet there a calculated built right in but a nationwide wester that used and children improve from it is edhelpercom this wester does work sheets and helps with the level the child is on in conclusion i think that computers do have a good impact on people they are entertaining keeps in contact and helpful with homework please take my reasons into consideration,4
computers are good for school uses skill and just for fun computers are a good source to have now that is just my opinion but i think computers are mostly for pretend and teenager adults mostly use them for business the fun uses that the computer provides are caps caps caps etc caps is one of the most popular chat groups on the internet caps is another popular chat group they both have some of the same characteristics like charting to your friends dating your status every now and then unloading pictures songs etc there are wester that could be used for free time like music wester where you are allowed to watch music video or download music onto your upon caps is a wester teenager of kiss go on to watch some of their favorite music video tunes is the program where you can download any song music video to show or movie onto and upon computers also provide microsoft caps publisher powerpoint etc all these can be used for school purpose caps allows you to type up anything you want for school you can type up a sum page essay if you wish you can cut and paste pictures for a project you might have due you can change the colons font size and font style on caps that use could be for a design on the front of a cover page for an essay or project publisher can be used for projects as well in school of you need to make a newspaper ulcers business cards etc publisher allows you to make them powerpoint is a program where you can make different sides in anything computers can be put to good use for many different things if people don agree with that then they don understand that computers help children and adults with everyday things some kiss who have special needs month need the computer to communicate with others computer i think are a big help in the world,8
i believe having computers in a household is a good idea they can play games learn talk and many more here are my three reasons having a computer is a good thing having a computer is great to play games there are so many varieties to choose from there are card games board games even sum games you can play solo but it might be more fun and easier to bring some friends along for the ride as you can see having a computer can be fun but its not the only thing to do on a computer using a computer to learn is wonderful too the computer can take you to places you have never seen heard or been to before or maybe a place you couldn afford to go you month learn that in on place its sunny all the time and in other places its not another thing the computer can teach you is about animals animals have been here way be for us there is still much we don know about them many scientists have spent their lives studying animal and have put it on the internet for you to better educate yourself the computer can also teach you handed handed is great to have if your trying out for a sport like football baseball and basketball also you never know when you need to catch something my final reason is also very helpful being able to talk on the computer is good to using voice chat or instant messenger is your choice while talking on the computer you might make some new friends that share the same interests and hobbies you do and you can chat with them as long as there online also while your talking you can express your ideas and feelings sometimes you might just need to blow off some steam or maybe post an idea that can one day be famous as you can see games learning and talking are easier to do on the computer this is why i think,5
do you love technology more and more people in this world are using so much technology and especially computers but not everyone agrees that this benefit society but i do because it can blue people the ability to learn about anything they want to learn then it can give a better communication to others that lives farther away from you my last reason is this technology can be a good way of protecting this country now i agree that computers can be useful man made force when i was about sum years old i loved to play on the computer i thought that this was just a game but my dad told me that do not abuse the computer use it for education i found out that there so many things to teeth about just a click of a cotton now you can use this technology as a tool not a game you might not want to go to the library to find a book you can just look it up in the computer people love to talk to others to meat new people or just communicate to others who live in a other country one of the best ways are on the computer i am sum years old and i have clod of friends that chat on the computer and i am one of them my family members live in location and i just can catch a plane every day to go visit them so i just go on the computer and talk to them its one of the fattest ways and fun ways to the organization has one of the strongest organization and organization in the world you would not believe the technology they have and how they use them one of the best things they have is the person caps a plane driven by a remote control its just like a fighter plane but without a pilot the person controlling it can relax in face will the person does all the work now come and join me to say that computers are useful in this world from the reasons above i state that computers are useful because they give people the ability to learn about anything they want it gives a way to communicate last caps a good way to protect this country technology is growing faster by the minute and stronger so take my word don abuse it use it,11
can you imagine how difficult life would be without a computer i can i believe computers are helpful computers help us do research they keep us connected with friends and family and they are required to be used at some caps the internet is a easy way to do research all you have to do is search what you want information on and millions of articles will be at the click of mouse using the internet on a computer is much easier than going through books looking for something that could waste a lot of time the internet can quickly and directly answer your questions computers are a great way to keep connected almost everyone has a email now all you have to do is type a few letters and you be reacquainted with a old friends when you call someone you can be sure if they are busy or not when using email the person receiving the email can reply when they hose free time computers are used at many caps sometimes your even required to use it computers organism data by keeping documents in different files computers also have valuable programs that could help you in your career such as organization word using a computer would aid you financial some of you might think computers have misleading information the internet isn always a honest place by spending a few minutes doublechecking your information on other wester your still spending less time than it would take to find the fact in a book the computer is one of the greatest inventions created it makes research connecting with friends and your caps easy use a computers date and your life will be changed for the better,2
the effects of computers to people are that adults and kiss are getting way more attention then they need to the first reason why is that most spend their time social networking the others are either buying things or playing games some of the people that are on the computers are wasting too much time being techsaavy its other ways people can spend their time like biting or taking a brisk walk another solution is you can get up on you learning skill or find a job around you town computers drain and waste peoples minds everyday i think it is essential for the people that can get off seek fitness and mental health than again it could be legitimate reasons to be on the computers spending as much time as you want the people that abuse the access of their computer too much should think and find something else to do i think till be a good idea to have a time when the computers should be shut off one day or a week by that i mean the cableenternet company should turn the internet and the cable off for a week of pure exercise that make people who are lazy to do something active till also be a good motivation for people who are on the computer or watching to too much then it would make everybody fit and health if they try i understand the elderly or senior citizens who need their computers for health help that understandable but everyone else should not be exempt computers and captors should be network disconnected to make people get off their feet and do something helpful or brain building everyday people are being digital sucked in some people in this world just can get enough of it and it need to dead soon the government should make a legal law that you must do something that will actively benefit you it should be a person of the state or local towns person that goes to every house another way that could be done is by one person from every street in the state go hometohome to make sure the procedure is being done a lot of people are not going to like it and they will not obey the new law it should be a penalty towards anyone that fails to abide by it the second choice should be a loss of internet services that make them really mad and in exchange they should still exercise sometimes it takes harsh laws to make somebody change,7
i not agreed the people should d in the computer a lot and i going to said way my first reason is because if you are a sum old man or your not going to d wit your kiss and you going to have eyes problem so that way you should in d in the computer a lot my second reason is the you going to have problem wit your wife if she found out the you are talking to another woman online because a lot of people they wife found out the they can d wit other woman my heard reason is the if you are a kid like me you not going to have fun and you not going to have friends because the computer problem came and go and not going to d wit your family and you ll sister out said playing wit her so that why you holding d a lot in the computer,1
being active has no limit but technology does,12
dear computer cop computers have a negative effect why would you go outside if you could play life like games on your caps i think that the games on t caps should be removed so people could enjoy all of the great things in life if people weren on caps s all day people would pay attention to the way there destroying nature,10
i agree with the newspaper people are spending too much time on the computer and not exercising everyone knows computers adjective but people need to get out more but people making it more admitting by creating things such as never ending games and its distracting people from there life family work and exercise,9
some people think it is a good idea and same do not my opinion is that i think that people spend a lot of time for good reasons here are three reasons why sum grownup working sum students learning how to type and sum communicating with others my first reason is that parents do a lot of work on computer for example they do taxes paperwork airline tickets and the bank and those are usually all done on the computer so it would be easier if people don drive my second reason is students need to learn how to type so they can email or even write on paper it helps them build learning ability and also so they can know how to sing the organization s computers are suppose to be fun for people of any age my last reason is communicating with others is a great skill to have so you can talk in person computers help because if you mess up of what your trying to say then you could just ease what your trying to say and in person you can also you can make plans with one of your friend on something if they live really far or something like that in my opinion i think people should be able to go on the computers to do work playmates no sites and many more other things to go on only if you have a computer at home,3
some people learn about far away places getting the latest updated on important news and making floppy work and hand writing seem nice neat all those thing are some positive benefits people have computers people all over use computers to research other places computers provide photographs of the place cheese is searching for example i remember when i had a social studies project on the person and i had to explain why its a great place to visit for its history mind i never even heard on a place called the person person but thanks to computers i growled person person person then the computer gave me all of into and photo about the mountain caps now i caps where and what the person person mountains look like secondly the computers has all the latest news happening all over the world i remember when the earthquake in habit first happened my grandmother had it happen until she got on line to check organization and when where and earthquake on the richer scale about computers was a i want the best hand writer in class and could write it out or do it on the computer plus we were getting grade on neatness evaporation and fleecy i choose to do it on the computer it came out nice and neat with picture computers has a very positive benefit on people world wide now matter if its for into news or to make thing gates,6
to the local newspaper computers have a heavy impact on today society people depend on them a lot but same people disagree i think that computers have a positive affect on people computers are very entertaining they can help find long lost friend and keep in contact with them plus they can be helpful with homework please proceed on reading to see as why i chose these reasons firstly computers can entertain the are thousands of games to chose from dress up to educational which are good for young children of age five through six as it states in the writing prompt it reaches handed coordination in addition to my first reason computers help long lost friends there are wester that help you find people for example caps caps and yakov these wester help keep in touch to with family if there no phone then there always the computer lastly computers can be helpful with homework sometimes you don even need internet there a calculated built right in but a nationwide wester that used and children improve from it is edhelpercom this wester does work sheets and helps with the level the child is on in conclusion i think that computers do have a good impact on people they are entertaining keeps in contact and helpful with homework please take my reasons into consideration,4
computers are good for school uses skill and just for fun computers are a good source to have now that is just my opinion but i think computers are mostly for pretend and teenager adults mostly use them for business the fun uses that the computer provides are caps caps caps etc caps is one of the most popular chat groups on the internet caps is another popular chat group they both have some of the same characteristics like charting to your friends dating your status every now and then unloading pictures songs etc there are wester that could be used for free time like music wester where you are allowed to watch music video or download music onto your upon caps is a wester teenager of kiss go on to watch some of their favorite music video tunes is the program where you can download any song music video to show or movie onto and upon computers also provide microsoft caps publisher powerpoint etc all these can be used for school purpose caps allows you to type up anything you want for school you can type up a sum page essay if you wish you can cut and paste pictures for a project you might have due you can change the colons font size and font style on caps that use could be for a design on the front of a cover page for an essay or project publisher can be used for projects as well in school of you need to make a newspaper ulcers business cards etc publisher allows you to make them powerpoint is a program where you can make different sides in anything computers can be put to good use for many different things if people don agree with that then they don understand that computers help children and adults with everyday things some kiss who have special needs month need the computer to communicate with others computer i think are a big help in the world,8
i believe having computers in a household is a good idea they can play games learn talk and many more here are my three reasons having a computer is a good thing having a computer is great to play games there are so many varieties to choose from there are card games board games even sum games you can play solo but it might be more fun and easier to bring some friends along for the ride as you can see having a computer can be fun but its not the only thing to do on a computer using a computer to learn is wonderful too the computer can take you to places you have never seen heard or been to before or maybe a place you couldn afford to go you month learn that in on place its sunny all the time and in other places its not another thing the computer can teach you is about animals animals have been here way be for us there is still much we don know about them many scientists have spent their lives studying animal and have put it on the internet for you to better educate yourself the computer can also teach you handed handed is great to have if your trying out for a sport like football baseball and basketball also you never know when you need to catch something my final reason is also very helpful being able to talk on the computer is good to using voice chat or instant messenger is your choice while talking on the computer you might make some new friends that share the same interests and hobbies you do and you can chat with them as long as there online also while your talking you can express your ideas and feelings sometimes you might just need to blow off some steam or maybe post an idea that can one day be famous as you can see games learning and talking are easier to do on the computer this is why i think,5
do you love technology more and more people in this world are using so much technology and especially computers but not everyone agrees that this benefit society but i do because it can blue people the ability to learn about anything they want to learn then it can give a better communication to others that lives farther away from you my last reason is this technology can be a good way of protecting this country now i agree that computers can be useful man made force when i was about sum years old i loved to play on the computer i thought that this was just a game but my dad told me that do not abuse the computer use it for education i found out that there so many things to teeth about just a click of a cotton now you can use this technology as a tool not a game you might not want to go to the library to find a book you can just look it up in the computer people love to talk to others to meat new people or just communicate to others who live in a other country one of the best ways are on the computer i am sum years old and i have clod of friends that chat on the computer and i am one of them my family members live in location and i just can catch a plane every day to go visit them so i just go on the computer and talk to them its one of the fattest ways and fun ways to the organization has one of the strongest organization and organization in the world you would not believe the technology they have and how they use them one of the best things they have is the person caps a plane driven by a remote control its just like a fighter plane but without a pilot the person controlling it can relax in face will the person does all the work now come and join me to say that computers are useful in this world from the reasons above i state that computers are useful because they give people the ability to learn about anything they want it gives a way to communicate last caps a good way to protect this country technology is growing faster by the minute and stronger so take my word don abuse it use it,11
