can you imagine how difficult life would be without a computer i can i believe computers are helpful computers help us do research they keep us connected with friends and family and they are required to be used at some caps the internet is a easy way to do research all you have to do is search what you want information on and millions of articles will be at the click of mouse using the internet on a computer is much easier than going through books looking for something that could waste a lot of time the internet can quickly and directly answer your questions computers are a great way to keep connected almost everyone has a email now all you have to do is type a few letters and you be reacquainted with a old friends when you call someone you can be sure if they are busy or not when using email the person receiving the email can reply when they hose free time computers are used at many caps sometimes your even required to use it computers organism data by keeping documents in different files computers also have valuable programs that could help you in your career such as organization word using a computer would aid you financial some of you might think computers have misleading information the internet isn always a honest place by spending a few minutes doublechecking your information on other wester your still spending less time than it would take to find the fact in a book the computer is one of the greatest inventions created it makes research connecting with friends and your caps easy use a computers date and your life will be changed for the better,2
the effects of computers to people are that adults and kiss are getting way more attention then they need to the first reason why is that most spend their time social networking the others are either buying things or playing games some of the people that are on the computers are wasting too much time being techsaavy its other ways people can spend their time like biting or taking a brisk walk another solution is you can get up on you learning skill or find a job around you town computers drain and waste peoples minds everyday i think it is essential for the people that can get off seek fitness and mental health than again it could be legitimate reasons to be on the computers spending as much time as you want the people that abuse the access of their computer too much should think and find something else to do i think till be a good idea to have a time when the computers should be shut off one day or a week by that i mean the cableenternet company should turn the internet and the cable off for a week of pure exercise that make people who are lazy to do something active till also be a good motivation for people who are on the computer or watching to too much then it would make everybody fit and health if they try i understand the elderly or senior citizens who need their computers for health help that understandable but everyone else should not be exempt computers and captors should be network disconnected to make people get off their feet and do something helpful or brain building everyday people are being digital sucked in some people in this world just can get enough of it and it need to dead soon the government should make a legal law that you must do something that will actively benefit you it should be a person of the state or local towns person that goes to every house another way that could be done is by one person from every street in the state go hometohome to make sure the procedure is being done a lot of people are not going to like it and they will not obey the new law it should be a penalty towards anyone that fails to abide by it the second choice should be a loss of internet services that make them really mad and in exchange they should still exercise sometimes it takes harsh laws to make somebody change,7
"isn it great getting a refreshing when your outside wouldn you experiences the rush of jumping into the crashing waves of the location instead of sitting inside gazing at pictures of the location you might think that computers are helping society today but you are wrong the human race has survived over hundreds of years without computers and we can survive hundreds more computers are helping society become more and more lazy we can get just as much information out of books if we try our best handed coordination is important and we can get it though activities such as football and tennis we can also get it from activities drawing reading and even playing an instrument can all improve handed coordination while letting you explore your creative side some people believe that computers teach handed coordination and it can but there are better ways to get it it would take longer to get it from a computer than an activity many people like to travel in all different places of the world but going to a foreign area with no knowledge don smart at all so what do you do go the most convenient source internet but what if i told you that any person could put anything on the internet you could be getting into on location when you think your getting into on location the most reliable source would be from a book reading is very powerful especially if your reading from a good source kiss lately have been making lives on the internet the only way they communicate is through online chat charting online canshould never replace time in person with friends relationships with others online is never real were using our knowledge of how to communicate with others the internet isn worth it so as you can see computers are no good thank you",23
"dear caps local caps i think that computers are on positive effect on people caps you think that there positive on people well ill give you sum reasons why you should say caps sum reaches handed coordination sum ability to learn and get your caps online sum you can talk to people all of the world these are caps sum reasons caps first reason is handed coordination if you have handed coordination you can caps anything this can help you get a job and even help with a sport you like having handed coordination is important because were in date everything goes around by computer and cell phone this is caps first reason caps second reason how the computer can teach people things the internet has a lot of web sites about how to get your caps online and you can take online classes there is a percent dropout rate and percent of those kid don have there caps so they go online to take there classes the computer can really help you this is caps second reason finally people go online to chat rooms to talk and met new people meeting new people is a good thing to caps you can learn about where and how the person lives chats rooms are cool to you can go online and talk to your friends without wasting your phone minutes the computer can help in many ways caps last reason ok in done but caps you remember that question i asked you caps you the computers are a positive effect on people caps caps you think i hope you say caps they are an positive effect but any ways those are caps sum reasons why is i hope you go out and buy a computer after reading this",21
"dear local newspaper computers are a useful tool when doing a school report or something to that effect but caps we really need those computers when using a computer for a school project caps can be a camel one of many problems people are based with while using a computer are freezing when doing a project and your computer frenzy caps can be very time consuming another problem is pop up pop up can house virtues and when you computer gets a virus caps leads to becoming very slow witch leads us to are next problem slowness when a computer becomes slow caps is very a digital there are several problems and risks that come with a computer one health problem is that you can become a helmet and stay inside all day because your too attached to the computer another problem is that you can become very obeyed because your not getting any physical exercise one risks of using a computer is that you could end up getting an fassebook caps or myspase and meeting some one who is pretending to be some one there not and get abducted by a molested there are other alterations you could make instead of using an computer one alternation is that you could go to the local library and cheek out books on your topics that your wanting information on another alternation is to ask teacher if she could land you a class text book but the main alternation is computer to old fashion books so now caps s your choicecaps we really need computers or can we live with out them caps s your choice",29
"dear local newspaper i feel very strong about my opinion of what effects computers have on people as in it helps others communicate with one another give people into about different types of things and make people smarter to me that sounds like something with a positive effect would you say first of all as some people say it doesn let you interact with family members yes it truly does you can interact with both friends and family members by going to chat rooms such as aim meeboweb can meeting such as skypecom so that throw that concern out or the window you work have to worry about that secondly you get to learn into about different types of things such as learning about wild animals any animal like a grief cat rat or learn about different places like location location and location etc also you could find all of this into at home in one day most important i would make people smarter the computer reaches you hand eye coordinations for free the computer can teach you about any career or regular job that you would need to learn about in just minutes if needed to conclude computers have positive effect on people it lets people communicate with friends and family you get to learn about different types of things and it makes people smarter even i was done reading this it i thanked the lord for computer it helps us so much",31
